{
  "$schema": "http://json-schema.org/draft-03/schema",
  "title": "Sales order details",
  "type": "object",
  "required": true,
  "properties": {
    "ID": {
      "type": "string",
      "maxLength": 36,
      "required": true
    },
    "automaticProformaInvoiceCommunication":{
      "type":"boolean",
      "required":true
    },
    "billingAddress": {
      "type": "object",
      "required": false,
      "properties": {
        "ID": {
          "type": "string",
          "maxLength": 36,
          "required": true
        },
        "addressLine": {
          "type": "string",
          "maxLength": 40,
          "required": true
        },
        "addressName": {
          "type": "string",
          "maxLength": 255,
          "required": true
        },
        "cityName": {
          "type": "string",
          "maxLength": 40,
          "required": true
        },
        "country": {
          "type": "object",
          "required": true,
          "properties": {
            "identificationCode": {
              "type": "string",
              "minLength": 2,
              "maxLength": 2,
              "required": true
            }
          }
        },
        "countrySubEntityCode": {
          "type": "string",
          "maxLength": 10,
          "required": false
        },
        "postalZone": {
          "type": "string",
          "maxLength": 20,
          "required": true
        }
      }
    },
    "billingContact": {
      "type": "object",
      "required": false,
      "properties": {
        "ID": {
          "type": "string",
          "maxLength": 36,
          "required": true
        },
        "firstName": {
          "type": "string",
          "maxLength": 40,
          "required": true
        },
        "familyName": {
          "type": "string",
          "maxLength": 80,
          "required": true
        }
      }
    },
    "businessCreationDate": {
      "type": "string",
      "format": "date-time",
      "required": true
    },
    "callOff": {
      "type": "boolean",
      "required": false
    },
    "confirmedDeliveryDate": {
      "type": "object",
      "required": false,
      "properties": {
        "from": {
          "type": "string",
          "format": "date",
          "required": true
        },
        "till": {
          "type": "string",
          "format": "date",
          "required": false
        },
        "isEditable": { 
          "type": "boolean", 
          "required": false 
        }         
      }
    },
    "creatorPerson": {
      "type": "object",
      "required": true,
      "properties": {
        "ID": {
          "type": "string",
          "maxLength": 36,
          "required": true
        },
        "firstName": {
          "type": "string",
          "maxLength": 40,
          "required": true
        },
        "familyName": {
          "type": "string",
          "maxLength": 80,
          "required": true
        }
      }
    },
    "currencyIsoCode": {
      "type": "string",
      "maxLength": 3,
      "minLength": 3,
      "required": false
    },
    "customer": {
      "type": "object",
      "required": true,
      "properties": {
        "ID": {
          "type": "string",
          "maxLength": 36,
          "required": true
        },
        "callSign": {
          "type": "string",
          "maxLength": 60,
          "required": true
        }
      }
    },
    "customerOrderReference": {
      "type": "string",
      "maxLength": 40,
      "required": false
    },
    "deliveryInstructions": {
      "type": "string",
      "maxLength": 2000,
      "required": false
    },
    "deliveryTerm": {
      "type": "object",
      "required": false,
      "properties": {
        "ID": {
          "type": "string",
          "maxLength": 36,
          "required": true
        },
        "description": {
          "type": "string",
          "maxLength": 50,
          "required": true
        }
      }
    },
    "deliveryTermAddress": {
      "type": "object",
      "required": false,
      "properties": {
        "ID": {
          "type": "string",
          "maxLength": 36,
          "required": true
        },
        "addressLine": {
          "type": "string",
          "maxLength": 40,
          "required": true
        },
        "addressName": {
          "type": "string",
          "maxLength": 255,
          "required": true
        },
        "cityName": {
          "type": "string",
          "maxLength": 40,
          "required": true
        },
        "country": {
          "type": "object",
          "required": true,
          "properties": {
            "identificationCode": {
              "type": "string",
              "minLength": 2,
              "maxLength": 2,
              "required": true
            }
          }
        },
        "countrySubEntityCode": {
          "type": "string",
          "maxLength": 10,
          "required": false
        },
        "postalZone": {
          "type": "string",
          "maxLength": 20,
          "required": true
        }
      }
    },
    "departureAddress": {
      "type": "object",
      "required": false,
      "properties": {
        "ID": {
          "type": "string",
          "maxLength": 36,
          "required": true
        },
        "addressLine": {
          "type": "string",
          "maxLength": 40,
          "required": true
        },
        "addressName": {
          "type": "string",
          "maxLength": 255,
          "required": true
        },
        "cityName": {
          "type": "string",
          "maxLength": 40,
          "required": true
        },
        "country": {
          "type": "object",
          "required": true,
          "properties": {
            "identificationCode": {
              "type": "string",
              "maxLength": 2,
              "minLength": 2,
              "required": true
            }
          }
        },
        "countrySubEntityCode": {
          "type": "string",
          "maxLength": 10,
          "required": false
        },
        "postalZone": {
          "type": "string",
          "maxLength": 20,
          "required": true
        }
      }
    },
    "destinationAddress": {
      "type": "object",
      "required": false,
      "properties": {
        "ID": {
          "type": "string",
          "maxLength": 36,
          "required": true
        },
        "addressLine": {
          "type": "string",
          "maxLength": 40,
          "required": true
        },
        "addressName": {
          "type": "string",
          "maxLength": 255,
          "required": true
        },
        "cityName": {
          "type": "string",
          "maxLength": 40,
          "required": true
        },
        "country": {
          "type": "object",
          "required": true,
          "properties": {
            "identificationCode": {
              "type": "string",
              "maxLength": 2,
              "minLength": 2,
              "required": true
            }
          }
        },
        "countrySubEntityCode": {
          "type": "string",
          "maxLength": 10,
          "required": false
        },
        "postalZone": {
          "type": "string",
          "maxLength": 20,
          "required": true
        }
      }
    },
    "fuelSurcharge": {
      "type": "boolean",
      "required": true
    },
    "internalComment": {
      "type": "string",
      "maxLength": 2000,
      "required": false
    },
    "locked": {
      "type":"boolean",
      "required": true
    },
    "loadDate": {
      "type": "string",
      "format": "date",
      "required": false
    },
    "loadDateIsEditable": { 
      "type": "boolean", 
      "required": false 
    },
    "loadingInstructions": {
      "type": "string",
      "maxLength": 2000,
      "required": false
    },
    "paymentCondition": {
      "type": "object",
      "required": false,
      "properties": {
        "ID": {
          "type": "string",
          "maxLength": 36,
          "required": true
        },
        "description": {
          "type": "string",
          "maxLength": 40,
          "required": true
        }
      }
    },
    "paymentDiscount": {
      "type": "object",
      "required": false,
      "properties": {
        "ID": {
          "type": "string",
          "maxLength": 36,
          "required": true
        },
        "description": {
          "type": "string",
          "maxLength": 50,
          "required": true
        }
      }
    },
    "entity": {
      "type": "object",
      "required": true,
      "properties": {
        "ID": {
          "type": "string",
          "maxLength": 36,
          "required": true
        },
        "callSign": {
          "type": "string",
          "maxLength": 60,
          "required": true
        }
      }
    },
    "reactiveSalesPerson": {
      "type": "object",
      "required": false,
      "properties": {
        "ID": {
          "type": "string",
          "maxLength": 36,
          "required": true
        },
        "firstName": {
          "type": "string",
          "maxLength": 40,
          "required": true
        },
        "familyName": {
          "type": "string",
          "maxLength": 80,
          "required": true
        }
      }
    },
    "rejectionReason": {
      "type": "object",
      "required": false,
      "properties": {
        "rejectionReasonID": {
          "type": "string",
          "maxLength": 36,
          "required": true
        },
        "rejectionReasonDesc": {
          "type": "string",
          "maxLength": 40,
          "required": true
        },
        "rejectionReasonComment": {
          "type": "string",
          "maxLength": 80,
          "required": false
        }
      }
    },
    "requestedDeliveryDate": {
      "type": "object",
      "required": false,
      "properties": {
        "from": {
          "type": "string",
          "format": "date",
          "required": true
        },
        "till": {
          "type": "string",
          "format": "date",
          "required": false
        }
      }
    },
    "requireManualAcceptance": {
      "type": "boolean",
      "required": true
    },
    "salesPerson": {
      "type": "object",
      "required": false,
      "properties": {
        "ID": {
          "type": "string",
          "maxLength": 36,
          "required": true
        },
        "firstName": {
          "type": "string",
          "maxLength": 40,
          "required": true
        },
        "familyName": {
          "type": "string",
          "maxLength": 80,
          "required": true
        }
      }
    },
    "status": {
      "type": "string",
      "maxLength": 50,
      "required": true
    },
    "systemCreationDate": {
      "type": "string",
      "format": "date-time",
      "required": true
    },
    "transportType": {
      "type": "object",
      "required": false,
      "properties": {
        "ID": {
          "type": "string",
          "maxLength": 36,
          "required": true
        },
        "description": {
          "type": "string",
          "maxLength": 50,
          "required": true
        }
      }
    },
    "version": {
      "type": "integer",
      "required": true
    },
    "orderLines": {
      "type": "array",
      "required": false,
      "items": {
        "title": "Sales order line detail",
        "type": "object",
        "properties": {
          "orderID": {
            "type": "string",
            "maxLength": 36,
            "required": true
          },
          "ID": {
            "type": "string",
            "maxLength": 36,
            "required": true
          },
          "businessCreationDate": {
            "type": "string",
            "format": "date-time",
            "required": true
          },
          "customerProductReference": {
            "type": "string",
            "maxLength": 60,
            "required": false
          },
          "grossMarginTwo": {
            "type": "object",
            "required": false,
            "properties": {
              "value": {
                "type": "number",
                "required": true
              },
              "timestampOfCalculation": {
                "type": "string",
                "format": "date-time",
                "required": true
              }
            }
          },
          "packaging": {
            "type": "object",
            "required": false,
            "properties": {
              "ID": {
                "type": "string",
                "maxLength": 36,
                "required": true
              },
              "description": {
                "type": "string",
                "maxLength": 50,
                "required": true
              }
            }
          },
          "printedProductDescription": {
            "type": "string",
            "maxLength": 255,
            "required": false
          },
          "product": {
            "type": "object",
            "required": true,
            "properties": {
              "ID":{
                "type": "string",
                "maxLength": 36,
                "required": true
              },
              "brandName": {
                "type": "string",
                "maxLength": 40,
                "required": true
              },
              "color": {
                "type": "object",
                "required":true,
                "properties": {
                  "ID":{
                    "type": "string",
                    "maxLength": 36,
                    "required": true
                  },
                  "description": {
                    "type": "string",
                    "maxLength": 50,
                    "required": true
                  }
                }
              },
              "grade": {
                "type": "string",
                "maxLength": 50,
                "required": true
              },
              "producerColorCode": {
                "type": "string",
                "maxLength": 30,
                "required": false
              }
            }
          },
          "quantityRavagoEntity": {
            "type": "object",
            "required": false,
            "properties": {
              "quantity": {
                "type": "number",
                "required": true
              },
              "unitCode": {
                "type": "string",
                "maxLength": 10,
                "required": true
              }
            }
          },
          "quantityCustomer": {
            "type": "object",
            "required": false,
            "properties": {
              "quantity": {
                "type": "number",
                "required": true
              },
              "unitCode": {
                "type": "string",
                "maxLength": 10,
                "required": true
              }
            }
          },
          "stateChecks": {
            "type": "array",
            "required": false,
            "items": {
              "type": "object",
              "required": true,
              "properties": {
                "check": {
                  "type": "string",
                  "required": true,
                  "maxLength": 50
                },
                "value": {
                  "type": "string",
                  "required": true,
                  "maxLength": 50
                }
              }
            }
          },
          "status": {
            "type": "string",
            "maxLength": 50,
            "required": true
          },
          "unitPriceCustomer": {
            "type": "object",
            "required": false,
            "properties": {
              "amount": {
                "type": "number",
                "required": true
              },
              "unitCode": {
                "type": "string",
                "maxLength": 10,
                "required": true
              }
            }
          },
          "unitPriceRavagoEntity": {
            "type": "object",
            "required": false,
            "properties": {
              "amount": {
                "type": "number",
                "required": true
              },
              "unitCode": {
                "type": "string",
                "maxLength": 10,
                "required": true
              }
            }
          },
          "version": {
            "type": "integer",
            "required": true
          }
        }
      }
    }
  }
}