{
  "ID": "SALES123",
  "automaticProformaInvoiceCommunication": false,
  "billingAddress": {
    "ID": "17831",
    "addressLine": "K Vypichu 1149",
    "addressName": "PORT BANGKOK",
    "cityName": "BANGKOK",
    "country": {
      "identificationCode": "TH"
    },
    "countrySubEntityCode": "BK",
    "postalZone": "THBKK"
  },
  "billingContact": {
    "ID": "123456",
    "firstName": "Jos",
    "familyName": "Smos"
  },
  "businessCreationDate": "2015-07-26T10:22:51Z",
  "callOff": false,
  "confirmedDeliveryDate": {
    "from": "2016-02-11",
    "till": "2016-02-15",
    "isEditable":true
  },
  "creatorPerson": {
    "ID": "100",
    "firstName": "Frits",
    "familyName": "Spits"
  },
  "currencyIsoCode": "EUR",
  "customer": {
    "ID": "12481",
    "callSign": "Loomans"
  },
  "customerOrderReference": "SALES4875",
  "deliveryInstructions": "These are my delivery instructions",
  "deliveryTerm": {
    "ID": "10",
    "description": "EXW"
  },
  "deliveryTermAddress": {
    "ID": "17831",
    "addressLine": "K Vypichu 1149",
    "addressName": "PORT BANGKOK",
    "cityName": "BANGKOK",
    "country": {
      "identificationCode": "TH"
    },
    "countrySubEntityCode": "BK",
    "postalZone": "THBKK"
  },
  "departureAddress": {
    "ID": "564972",
    "addressLine": "Zeelsebaan 24",
    "addressName": "MOENS VERPAKKINGEN",
    "cityName": "DENDERMONDE",
    "country": {
      "identificationCode": "BE"
    },
    "countrySubEntityCode": "OV",
    "postalZone": "9200"
  },
  "destinationAddress": {
    "ID": "583583",
    "addressLine": "Postbus 1350",
    "addressName": "BOEKELO DECOR",
    "cityName": "ENSCHEDE",
    "country": {
      "identificationCode": "NL"
    },
    "countrySubEntityCode": "OVL",
    "postalZone": "7500 BJ"
  },
  "fuelSurcharge": true,
  "internalComment": "This is my internal comment",
  "locked": true,
  "loadDate": "2016-02-07",
  "loadDateIsEditable":true,
  "loadingInstructions": "These are my loading instructions",
  "paymentCondition": {
    "ID": "10",
    "description": "30 days"
  },
  "paymentDiscount": {
    "ID": "21",
    "description": "5%"
  },
  "entity": {
    "ID": "124",
    "callSign": "Company Distribution"
  },
  "reactiveSalesPerson": {
    "ID": "71948",
    "firstName": "Tom",
    "familyName": "Aat"
  },
  "rejectionReason": {
    "rejectionReasonID": "12345",
    "rejectionReasonDesc": "Wrong Data",
    "rejectionReasonComment": "This order was rejected because the wrong sales person was entered"
  },
  "requestedDeliveryDate": {
    "from": "2016-01-15",
    "till": "2016-02-29"
  },
  "requireManualAcceptance": true,
  "salesPerson": {
    "ID": "201591",
    "firstName": "Peter",
    "familyName": "Seli"
  },
  "status": "Rejected",
  "systemCreationDate": "2016-01-07T10:22:57Z",
  "transportType": {
    "ID": "124",
    "description": "ROAD"
  },
  "version": 1,
  "orderLines": [
    {
      "orderID": "SALES123",
      "ID": "SALESLINE12156",
      "businessCreationDate": "2016-01-02T10:22:50Z",
      "customerProductReference": "CUSTPROD",
      "packaging": {
        "ID": "74",
        "description": "plastic bag 25 kg"
      },
      "grossMarginTwo": {
        "value": 22,
        "timestampOfCalculation": "2016-02-17T17:22:35Z"
      },
      "printedProductDescription": "This is the product description that will be printed",
      "product": {
        "ID": "123",
        "brandName": "DOW",
        "color": {
          "ID": "123",
          "description": "BLACK"
        },
        "grade": "LDPE",
        "producerColorCode": "DARK"
      },
      "quantityRavagoEntity": {
        "quantity": 750,
        "unitCode": "kg"
      },
      "quantityCustomer": {
        "quantity": 1653.46,
        "unitCode": "lb"
      },
      "stateChecks": [
        {
          "check": "AVAILABILITY",
          "value": "NOT_ASSIGNED"
        },
        {
          "check": "COMMERCIAL_VIABILITY",
          "value": "APPROVED"
        },
        {
          "check": "CREDIT",
          "value": "NOT_ASSIGNED"
        }
      ],
      "status": "Accepted",
      "unitPriceCustomer": {
        "amount": 1.25,
        "unitCode": "kg"
      },
      "unitPriceRavagoEntity": {
        "amount": 0.5669,
        "unitCode": "lb"
      },
      "version": 1
    }
  ]
}